{
  "title": "Tác động của AI lên năng suất làm việc",
  "summary": "Bài nói trình bày cách các công cụ trí tuệ nhân tạo hỗ trợ tự động hóa tác vụ lặp lại, gợi ý nội dung và cải thiện tốc độ xử lý công việc. Diễn giả nhấn mạnh tầm quan trọng của việc thiết lập quy trình kiểm duyệt để đảm bảo chất lượng và đạo đức khi áp dụng AI vào môi trường doanh nghiệp.\n\n• Công cụ AI tự động hóa các tác vụ lặp lại, giảm công việc thủ công và tăng hiệu suất\n• Tính năng gợi ý nội dung giúp nhân viên sáng tạo hơn và tăng tốc độ tạo nội dung\n• Quy trình kiểm duyệt chất lượng đảm bảo tính chính xác của kết quả AI\n• Đạo đức trong AI là yếu tố quan trọng khi triển khai trong doanh nghiệp\n• Sự kết hợp giữa automation và kiểm soát chất lượng tạo ra giá trị tối ưu\n• Cần đào tạo nhân viên để sử dụng công cụ AI một cách hiệu quả",
  "key_topics": [
    "Tự động hóa AI",
    "Năng suất làm việc",
    "Gợi ý nội dung",
    "Kiểm duyệt chất lượng",
    "Đạo đức AI",
    "Doanh nghiệp",
    "Công nghệ"
  ],
  "tags": [
    "ai",
    "năng suất",
    "doanh nghiệp",
    "automation",
    "chất lượng",
    "đạo đức"
  ]
}
