{
  "title": "Tác động của AI lên năng suất làm việc",
  "summary": "Bài nói trình bày cách các công cụ trí tuệ nhân tạo hỗ trợ tự động hóa tác vụ lặp lại, gợi ý nội dung và cải thiện tốc độ xử lý công việc. Diễn giả nhấn mạnh tầm quan trọng của việc thiết lập quy trình kiểm duyệt để đảm bảo chất lượng và đạo đức khi áp dụng AI vào môi trường doanh nghiệp.",
  "key_topics": [
    "Tự động hóa tác vụ",
    "Gợi ý nội dung",
    "Quy trình kiểm duyệt",
    "Đạo đức trong AI"
  ],
  "tags": ["ai", "năng suất", "doanh nghiệp"]
}

